{"namespace":"structure","instrument_id":"FR0000000001","field":"ter","value":0.001,"as_of":"2026-08-21T14:00:00Z","collected_at":"2026-08-21T14:01:00Z","source":"issuer","value_hash":"aaaaaaaaaaaaaaaaaaaaaaaaaaaaaaaaaaaaaaaaaaaaaaaaaaaaaaaaaaaaaaaa","pit_status":"VERIFIED","ttl_policy":"P1D","quarantine_reason":null}
